{
  "$schema": "https://json-schema.org/draft/2020-12/schema",
  "$id": "https://github.com/velimattiv/claude-security-audit/lib/credential-ledger-schema.json",
  "title": "Phase-02 Credential Mint/Consume Ledger",
  "description": "Every credential/claim the system mints (cookie, JWT, CSRF token, signed/presigned URL, capability cookie, API key, session, feature-flag gate, licence), with its WRITE sites (mint) and READ sites (consume) and the resources it is supposed to gate. scripts/validate-egress.py asserts a consumer sits on every byte-serving path to each protected resource — the 'control with no enforcer' detector, mechanized.",
  "type": "object",
  "required": ["schema_version", "credentials"],
  "properties": {
    "schema_version": { "const": 1 },
    "skill_version": { "type": "string" },
    "audit_id": { "type": "string" },
    "generated_at": { "type": "string" },
    "notes": { "type": "array", "items": { "type": "string" } },
    "credentials": {
      "type": "array",
      "items": {
        "type": "object",
        "required": ["name", "kind", "writers", "readers", "protects_resources"],
        "properties": {
          "name": { "type": "string", "description": "The claim's identifier (cookie name, token name, header)." },
          "kind": {
            "enum": ["cookie", "jwt", "csrf", "signed_url", "capability",
                     "api_key", "pat", "session", "feature_flag", "license",
                     "verification"]
          },
          "writers": {
            "type": "array",
            "description": "Mint sites. Each is where the claim is issued/set.",
            "items": {
              "type": "object",
              "required": ["file"],
              "properties": {
                "file": { "type": "string" },
                "line": { "type": "integer", "minimum": 1 }
              }
            }
          },
          "readers": {
            "type": "array",
            "description": "Consume sites. Each is where the claim is validated/honored.",
            "items": {
              "type": "object",
              "required": ["file"],
              "properties": {
                "file": { "type": "string" },
                "line": { "type": "integer", "minimum": 1 }
              }
            }
          },
          "validation_at_readers": {
            "type": "array",
            "items": { "type": "string" },
            "description": "What each reader actually checks (signature, expiry, allow-list). Ranked by validate-egress.py to infer the gate strength the credential implies."
          },
          "protects_resources": {
            "type": "array",
            "items": { "type": "string" },
            "description": "Canonical data_model entity ids this credential is supposed to gate. If a protected resource has a byte-serving path that never consumes this credential, that path is a finding."
          }
        }
      }
    },
    "dismissed": {
      "type": "array",
      "items": {
        "type": "object",
        "required": ["candidate", "reason"],
        "properties": {
          "candidate": { "type": "string" },
          "reason": { "type": "string" }
        }
      }
    }
  }
}
