{
  "schema_version": 1,
  "skill_version": "2.6.0",
  "credentials": [
    {
      "name": "claude_oauth_access_token",
      "kind": "session",
      "writers": [{"file": "plugin/hooks/session-start.mjs", "line": 64}],
      "readers": [{"file": "plugin/scripts/otel-headers-helper.sh", "line": 283}],
      "validation_at_readers": ["presented as a bearer token; no local validation"],
      "protects_resources": ["OAuthAccessToken"]
    }
  ],
  "dismissed": []
}
