{
  "schema_version": 1,
  "skill_version": "2.6.0",
  "credentials": [
    {
      "name": "device_token",
      "kind": "api_key",
      "writers": [{"file": "server/api/tokens/redeem.post.ts", "line": 120}],
      "readers": [{"file": "server/middleware/01.device-auth.ts", "line": 18}],
      "validation_at_readers": ["lookup token, check device scope"],
      "protects_resources": ["DeviceToken"]
    }
  ],
  "dismissed": []
}
