{
  "schema_version": 1,
  "skill_version": "2.6.0",
  "credentials": [
    {
      "name": "app.user_org_path",
      "kind": "capability",
      "writers": [{"file": "server/db/rls.ts", "line": 22}],
      "readers": [{"file": "server/db/rls.ts", "line": 40}],
      "validation_at_readers": [
        "per-request set_config('app.user_org_path', ...); every RLS policy reads current_setting and clamps rows to the caller's org subtree"
      ],
      "protects_resources": ["CostCentre"]
    },
    {
      "name": "__share_sv",
      "kind": "capability",
      "writers": [{"file": "server/api/share/verify.post.ts", "line": 88}],
      "readers": [{"file": "server/api/share/[id].get.ts", "line": 12}],
      "validation_at_readers": ["cookie signature + step-up 2FA email verification"],
      "protects_resources": ["SessionShare"]
    }
  ],
  "dismissed": []
}
