{
  "schema_version": 1,
  "skill_version": "2.6.0",
  "credentials": [
    {
      "name": "otel_refresh_token",
      "kind": "pat",
      "writers": [{"file": "plugin/hooks/session-start.mjs", "line": 64}],
      "readers": [{"file": "plugin/scripts/otel-headers-helper.sh", "line": 120}],
      "validation_at_readers": ["presented to the token endpoint; org scope checked server-side"],
      "protects_resources": ["OAuthRefreshToken", "OAuthAccessToken"]
    },
    {
      "name": "otlp_ingest_hmac",
      "kind": "signed_url",
      "writers": [{"file": "server/api/setup/enroll.post.ts", "line": 145}],
      "readers": [{"file": "server/api/otlp/ingest.post.ts", "line": 30}],
      "validation_at_readers": ["HMAC over the body, then an org scope check on the tenant claim"],
      "protects_resources": ["TelemetryPayload", "OtlpSpan", "ProvisionalCredential"]
    }
  ],
  "dismissed": []
}
