{
  "schema_version": 1,
  "skill_version": "2.4.0",
  "credentials": [
    {
      "name": "__sv_",
      "kind": "capability",
      "writers": [
        {"file": "server/api/s/[shortId]/verify.get.ts", "line": 95}
      ],
      "readers": [
        {"file": "server/api/s/[shortId].get.ts", "line": 40}
      ],
      "validation_at_readers": ["verifyCookieSignature + hasValidVerification (2FA email verification)"],
      "protects_resources": ["Deck"]
    },
    {
      "name": "X-API-Key",
      "kind": "api_key",
      "writers": [
        {"file": "server/api/keys/issue.post.ts", "line": 30}
      ],
      "readers": [
        {"file": "server/middleware/01.auth.ts", "line": 12}
      ],
      "validation_at_readers": ["lookup key, check scope"],
      "protects_resources": ["Invoice"]
    }
  ],
  "dismissed": []
}
